{
  "schemaVersion": 1,
  "asOf": "2026-08-11",
  "status": "close_contract_ready_restricted_actuals_gated",
  "purpose": "Define the restricted-source, accountable-owner, reconciliation, review, cost-driver, exception, retention, and close-cycle evidence required before Mythical calculates runway, publishes forecasts, activates financial integrations, approves spend, or makes monetization commitments.",
  "decisionRefs": ["D-006", "D-013", "D-016"],
  "riskRefs": ["R-007", "R-008", "R-009", "R-012", "R-013"],
  "workflowRefs": ["A-009", "A-010", "A-011", "A-022", "A-025", "A-031", "A-032", "A-035", "A-038"],
  "authority": {
    "accountingAccessAuthorized": false,
    "bankingAccessAuthorized": false,
    "billingAccessAuthorized": false,
    "invoiceAccessAuthorized": false,
    "providerUsageAccessAuthorized": false,
    "restrictedActualsImportAuthorized": false,
    "financialSourceWriteAuthorized": false,
    "forecastPublicationAuthorized": false,
    "spendApprovalAuthorized": false,
    "paymentExecutionAuthorized": false,
    "pricingChangeAuthorized": false,
    "revenueRecognitionAuthorized": false,
    "contractOrSubscriptionChangeAuthorized": false,
    "externalActionAuthorized": false,
    "conversationIsAuthorization": false
  },
  "dataBoundary": {
    "restrictedActualValuesInSharedRepositoryPermitted": false,
    "bankOrPaymentIdentifiersInSharedRepositoryPermitted": false,
    "transactionRowsInSharedRepositoryPermitted": false,
    "invoiceOrReceiptContentsInSharedRepositoryPermitted": false,
    "payrollTaxInvestorOrCustomerRecordsInSharedRepositoryPermitted": false,
    "credentialsOrRecoveryValuesInSharedRepositoryPermitted": false,
    "opaqueRestrictedSourceReferencesPermitted": true,
    "approvedAggregateOperatingOutputsPermitted": true,
    "unknownValuesRemainNull": true,
    "missingEvidenceMeansZero": false,
    "freeTierMeansActualCostIsZero": false,
    "publicPriceMeansCompanyPriceIsVerified": false
  },
  "humanRoles": {
    "financeOwner": { "status": "unassigned", "personOrRoleRef": null, "acceptanceRecorded": false },
    "backupOwner": { "status": "unassigned", "personOrRoleRef": null, "acceptanceRecorded": false },
    "closePreparer": { "status": "unassigned", "personOrRoleRef": null, "acceptanceRecorded": false },
    "independentReviewer": { "status": "unassigned", "personOrRoleRef": null, "acceptanceRecorded": false },
    "accountingTaxReviewer": { "status": "unassigned", "personOrRoleRef": null, "acceptanceRecorded": false },
    "exceptionRecipient": { "status": "unassigned", "personOrRoleRef": null, "acceptanceRecorded": false },
    "preparerReviewerSeparated": false,
    "ownerBackupSeparated": false,
    "rolesApproved": false
  },
  "restrictedSourceClasses": [
    { "id": "FS-001", "sourceClass": "Accounting ledger and reconciled close reports", "providerOrProcess": null, "opaqueSourceRef": null, "ownerConfirmed": false, "readIdentityConfigured": false, "connected": false },
    { "id": "FS-002", "sourceClass": "Bank and cash balance reconciliation", "providerOrProcess": null, "opaqueSourceRef": null, "ownerConfirmed": false, "readIdentityConfigured": false, "connected": false },
    { "id": "FS-003", "sourceClass": "Approved contracts, commitments, invoices, and renewals", "providerOrProcess": null, "opaqueSourceRef": null, "ownerConfirmed": false, "readIdentityConfigured": false, "connected": false },
    { "id": "FS-004", "sourceClass": "Revenue, billing, payment, refund, and fee reports", "providerOrProcess": null, "opaqueSourceRef": null, "ownerConfirmed": false, "readIdentityConfigured": false, "connected": false },
    { "id": "FS-005", "sourceClass": "Provider usage, quota, plan, price, tax, credit, and retry reports", "providerOrProcess": null, "opaqueSourceRef": null, "ownerConfirmed": false, "readIdentityConfigured": false, "connected": false },
    { "id": "FS-006", "sourceClass": "Payroll, contractor, tax, and professional-service obligations", "providerOrProcess": null, "opaqueSourceRef": null, "ownerConfirmed": false, "readIdentityConfigured": false, "connected": false }
  ],
  "baselineEvidenceClasses": [
    { "id": "FB-001", "evidenceClass": "Verified legal entity and accounting perimeter", "status": "missing", "opaqueSourceRef": null, "valueStoredHere": false, "reconciled": false },
    { "id": "FB-002", "evidenceClass": "Reporting currency, fiscal year, tax and accounting basis", "status": "missing", "opaqueSourceRef": null, "valueStoredHere": false, "reconciled": false },
    { "id": "FB-003", "evidenceClass": "Unrestricted and restricted cash at a reconciled cutoff", "status": "missing", "opaqueSourceRef": null, "valueStoredHere": false, "reconciled": false },
    { "id": "FB-004", "evidenceClass": "Committed liabilities, contracts, renewals, and purchase obligations", "status": "missing", "opaqueSourceRef": null, "valueStoredHere": false, "reconciled": false },
    { "id": "FB-005", "evidenceClass": "Trailing recognized and collected revenue with fees and refunds separated", "status": "missing", "opaqueSourceRef": null, "valueStoredHere": false, "reconciled": false },
    { "id": "FB-006", "evidenceClass": "Trailing operating expense by approved cost category", "status": "missing", "opaqueSourceRef": null, "valueStoredHere": false, "reconciled": false },
    { "id": "FB-007", "evidenceClass": "Forward fixed obligations including payroll and contractor commitments", "status": "missing", "opaqueSourceRef": null, "valueStoredHere": false, "reconciled": false },
    { "id": "FB-008", "evidenceClass": "Variable AI, hosting, storage, egress, support, and research costs", "status": "missing", "opaqueSourceRef": null, "valueStoredHere": false, "reconciled": false },
    { "id": "FB-009", "evidenceClass": "Tax, VAT, payment processor, refund, and platform obligations", "status": "missing", "opaqueSourceRef": null, "valueStoredHere": false, "reconciled": false },
    { "id": "FB-010", "evidenceClass": "Active vendor plans, regions, prices, credits, free allowances, minimums, and overages", "status": "missing", "opaqueSourceRef": null, "valueStoredHere": false, "reconciled": false },
    { "id": "FB-011", "evidenceClass": "Usage and accepted-output counts linked to each material variable cost driver", "status": "missing", "opaqueSourceRef": null, "valueStoredHere": false, "reconciled": false },
    { "id": "FB-012", "evidenceClass": "Approved spend limits, exception thresholds, and technical stop controls", "status": "missing", "opaqueSourceRef": null, "valueStoredHere": false, "reconciled": false }
  ],
  "closeCalendar": {
    "reportingTimezone": null,
    "periodCadence": null,
    "cutoffDayOrRule": null,
    "sourceFreezeRuleRef": null,
    "preparerDueRule": null,
    "reviewerDueRule": null,
    "exceptionDueRule": null,
    "stalenessThresholdDays": null,
    "calendarApproved": false
  },
  "reconciliationControls": {
    "bankToLedgerReconciliationRequired": true,
    "invoiceContractPaymentLinkageRequired": true,
    "recognizedAndCollectedRevenueSeparated": true,
    "restrictedAndUnrestrictedCashSeparated": true,
    "committedAndDiscretionarySpendSeparated": true,
    "currencyConversionSourceAndDateRequired": true,
    "providerPricePlanRegionTaxAndDateRequired": true,
    "usageRequestSuccessAcceptanceAndViewCountsSeparated": true,
    "retryFailureCreditAndFreeAllowanceVisible": true,
    "duplicateChargeAndDuplicateInvoiceCheckRequired": true,
    "unreconciledDifferenceThresholdMinorUnits": null,
    "materialVarianceThresholdBasisPoints": null,
    "controlsApproved": false,
    "controlsTested": false
  },
  "currentModelEvidence": {
    "workflowRef": "A-022",
    "modelRef": "docs/company/finance/financial-model.json",
    "modelValid": true,
    "financialBaselineComplete": false,
    "costDriverCount": 7,
    "verifiedCostDriverCount": 0,
    "monetizationHypothesisCount": 6,
    "monetizationDecisionReadyCount": 0,
    "publishedRunwayAvailable": false,
    "externalSpendAuthorized": false,
    "externalRevenueActionAuthorized": false
  },
  "requiredExercises": [
    { "id": "FGX-001", "scenario": "A missing or stale restricted source prevents close and any runway calculation", "status": "not_run", "passed": false },
    { "id": "FGX-002", "scenario": "Bank-to-ledger difference remains visible and blocks reviewed actuals above the approved threshold", "status": "not_run", "passed": false },
    { "id": "FGX-003", "scenario": "Duplicate invoice or charge is detected before it can enter approved cost totals", "status": "not_run", "passed": false },
    { "id": "FGX-004", "scenario": "Currency, tax, plan, region, credit, free allowance, and price-date mismatch fails closed", "status": "not_run", "passed": false },
    { "id": "FGX-005", "scenario": "Provider retry, failure, abuse, or acceptance-yield deterioration produces a reviewed exception", "status": "not_run", "passed": false },
    { "id": "FGX-006", "scenario": "Restricted actual, bank, invoice, payroll, tax, investor, or customer data cannot enter shared output", "status": "not_run", "passed": false },
    { "id": "FGX-007", "scenario": "Preparer cannot approve the close or suppress a material unresolved exception", "status": "not_run", "passed": false },
    { "id": "FGX-008", "scenario": "Spend request above zero or an unapproved threshold remains blocked without trusted separate approval", "status": "not_run", "passed": false },
    { "id": "FGX-009", "scenario": "Read identity, export, calculation, alert, and future executor can be revoked or killed independently", "status": "not_run", "passed": false },
    { "id": "FGX-010", "scenario": "Protected source references, close evidence, backup, restore, retention, deletion, and replay controls recover accurately", "status": "not_run", "passed": false }
  ],
  "activationGates": [